<?xml version="1.0" encoding="UTF-8" standalone="yes"?><Bestilling xsi:noNamespaceSchemaLocation="printoppdrag-2_2.xsd" xmlns:xsi="http://www.w3.org/2001/XMLSchema-instance"><BestillingsInfo bestillingsId="insertCallIdHere" kundeId="NAV_IKT"><DokumentInfo destinasjon="INNLAND" sorteringsfelt="USORTERT"/><Kanal behandling="B_X_D" type="PRINT"/></BestillingsInfo><Mailpiece mailpieceId="insertCallIdHere"><Ressurs><Adresse>&lt;![CDATA[mottakerNavn&#13;adresselinjeEn&#13;adresselinjeTo&#13;adresselinjeTre&#13;123 poststed&#13;NO]]&gt;</Adresse></Ressurs><Postnummer>123</Postnummer><Dokument dokumentId="dokumentObjektReferanseHoveddok" dokumentType="NAV_STANDARD"><Skattyternummer>mottakerId</Skattyternummer><Navn>&lt;![CDATA[mottakerNavn]]&gt;</Navn><Postnummer>123</Postnummer></Dokument><Dokument dokumentId="dokumentObjektReferanseVedlegg1" dokumentType="NAV_STANDARD"><Skattyternummer>mottakerId</Skattyternummer><Navn>&lt;![CDATA[mottakerNavn]]&gt;</Navn><Postnummer>123</Postnummer></Dokument><Dokument dokumentId="dokumentObjektReferanseVedlegg2" dokumentType="NAV_STANDARD"><Skattyternummer>mottakerId</Skattyternummer><Navn>&lt;![CDATA[mottakerNavn]]&gt;</Navn><Postnummer>123</Postnummer></Dokument></Mailpiece></Bestilling>