<?xml version="1.0" encoding="UTF-8" standalone="yes"?><Bestilling xsi:noNamespaceSchemaLocation="printoppdrag-2_2.xsd" xmlns:xsi="http://www.w3.org/2001/XMLSchema-instance"><BestillingsInfo bestillingsId="insertCallIdHere" kundeId="NAV_IKT"><DokumentInfo destinasjon="INNLAND" sorteringsfelt="USORTERT"/><Kanal behandling="B_X_D" type="PRINT"/></BestillingsInfo><Mailpiece mailpieceId="insertCallIdHere"><Ressurs><Adresse><![CDATA[mottakerNavn\rlinje1\rlinje2\rlinje3\r3020 Drammen\rTYRKIA]]></Adresse></Ressurs><Landkode>TR</Landkode><Dokument dokumentId="dokumentObjektReferanseHoveddok" dokumentType="NAV_STANDARD"><Navn><![CDATA[mottakerNavn]]></Navn><Landkode>TR</Landkode></Dokument><Dokument dokumentId="dokumentObjektReferanseVedlegg1" dokumentType="NAV_STANDARD"><Navn><![CDATA[mottakerNavn]]></Navn><Landkode>TR</Landkode></Dokument><Dokument dokumentId="dokumentObjektReferanseVedlegg2" dokumentType="NAV_STANDARD"><Navn><![CDATA[mottakerNavn]]></Navn><Landkode>TR</Landkode></Dokument></Mailpiece></Bestilling>