<?xml version="1.0" encoding="UTF-8" standalone="yes"?><Bestilling xsi:noNamespaceSchemaLocation="printoppdrag-2_2.xsd" xmlns:xsi="http://www.w3.org/2001/XMLSchema-instance"><BestillingsInfo bestillingsId="insertCallIdHere" kundeId="NAV_IKT"><DokumentInfo destinasjon="INNLAND" sorteringsfelt="USORTERT"/><Kanal behandling="B_X_D" type="PRINT"/></BestillingsInfo><Mailpiece mailpieceId="insertCallIdHere"><Ressurs><Adresse>&lt;![CDATA[mottakerNavn&#13;linje1&#13;linje2&#13;linje3&#13;3020 Drammen&#13;TR]]&gt;</Adresse></Ressurs><Landkode>TR</Landkode><Dokument dokumentId="dokumentObjektReferanseHoveddok" dokumentType="NAV_STANDARD"><Skattyternummer>mottakerId</Skattyternummer><Navn>&lt;![CDATA[mottakerNavn]]&gt;</Navn><Landkode>TR</Landkode></Dokument><Dokument dokumentId="dokumentObjektReferanseVedlegg1" dokumentType="NAV_STANDARD"><Skattyternummer>mottakerId</Skattyternummer><Navn>&lt;![CDATA[mottakerNavn]]&gt;</Navn><Landkode>TR</Landkode></Dokument><Dokument dokumentId="dokumentObjektReferanseVedlegg2" dokumentType="NAV_STANDARD"><Skattyternummer>mottakerId</Skattyternummer><Navn>&lt;![CDATA[mottakerNavn]]&gt;</Navn><Landkode>TR</Landkode></Dokument></Mailpiece></Bestilling>